Flow_ID,Activity,Data_Class,Source,Destination,Storage,Sync,Permission,User_Exposure,Risk,Control,Status,Evidence
PRIV-001,Diving,Surface GPS entry/exit,Watch runtime,Diving logbook,Diving-only stores,activity-scoped sync,When In Use,Visible in Diving views only,Low,Activity routing + isolation tests,PASS,Audit 01/02/03 docs at 7ae527b
PRIV-002,Apnea,Surface start/end GPS metadata,Watch runtime,Apnea logbook,Apnea-only stores,activity-scoped sync,When In Use,Visible in Apnea views only,Low,Apnea namespace and store isolation,PASS,Apnea isolation docs/tests consumed
PRIV-003,Snorkeling,Route track + quality metadata,Watch runtime,Snorkeling logbook,Snorkeling-only stores,activity-scoped sync,When In Use,Visible in Snorkeling and optional unified presentation,Medium,No merged canonical store; route namespace isolation,PASS,V1.7 snorkeling docs + tests
PRIV-004,All,Unified timeline rows,iOS presentation builder,Unified list UI,Derived read-model only,no outbound mutation,none,new optional aggregate view,Medium,Presentation-only architecture + no contamination tests,PASS,IOSUnifiedLogbookNoContaminationTests
PRIV-005,All,Sync envelope metadata,Watch/iOS sync services,paired peer,transport-only,namespaced + signed,HMAC/replay controls,not directly user-visible,Low,Signed transport + replay cache,PASS,ActivitySync envelope/auth tests
PRIV-006,All,Location permission text,Info.plist manifests,OS privacy dialog,system managed,n/a,When In Use only,user consent gate,Medium,No Always-location key in inspected plist,PASS,App/Info.plist + iOSApp/App/Info.plist
PRIV-007,Snorkeling,Open-water route evidence,physical sessions,QA evidence docs,Docs artifacts only,n/a,n/a,not a runtime flow,High if misclaimed,Keep as pending until artifacts,PENDING_PHYSICAL,No physical evidence attached in this pass
